{
  "$schema": "https://fluidsbench.org/schemas/v3/evaluation-evidence.schema.json",
  "schema_version": "3.0",
  "submission_id": "hiliftaeroml-transolver-aoa22-candidate-v1",
  "dataset_id": "hiliftaeroml",
  "dataset_version": "hiliftaeroml-native-v1-candidate",
  "split_id": "single_aoa_22",
  "split_sha256": "d8754a74ceb06fce476df0e92f683fc4503c74eac2d3043a5ccd82515ef89f62",
  "case_set_id": "caseset-85ecccd9ccda",
  "prediction_scope": "surface_and_volume",
  "reference_version": "hiliftaeroml-evaluator-v0.1-candidate",
  "dataset_evaluator_binding": {
    "status": "frozen",
    "reference_version": "hiliftaeroml-evaluator-v0.1-candidate",
    "code_revision": "68899f780d96b70f2badb5658971c87af0b17172"
  },
  "command": "python scripts/assemble_hiliftaeroml_schema_v3_candidate.py --config examples/hiliftaeroml-v3-candidate/transolver-sixsplit-candidate-configs/transolver-aoa22-candidate-config.json --native-aggregate ../hiliftaeroml-transolver-submission-v1/aggregates/sixsplit_v1/single_aoa_22/aggregate-a --native-surface-outputs ../hiliftaeroml-transolver-submission-v1/outputs/sixsplit_v1/single_aoa_22 --native-volume-outputs ../hiliftaeroml-transolver-submission-v1/outputs/sixsplit_v1/single_aoa_22 --native-receipts ../hiliftaeroml-transolver-submission-v1/outputs/sixsplit_v1_receipts/single_aoa_22/receipts-a --candidate-compact-profile-support-release ../eval_runs/hilift_compact_profile_support_v2_candidate_20260906/release/hiliftaeroml-compact-profile-support-v2-candidate --output ../hiliftaeroml-transolver-submission-v1/release/sixsplit_schema_v3_compact_candidate_20260906/packages/single_aoa_22/package-a",
  "generated_at": "2026-09-06T11:54:23-07:00",
  "status": "submitted_evaluation",
  "metric_values": {
    "overall_score": 36.35862929830084,
    "field_score": 11.227690301285762,
    "force_score": 90.52018161087223,
    "diagnostic_score": 32.4589549797596,
    "surface_pressure_rel_l2": 11.955702904270492,
    "surface_pressure_equal_entity_rel_l2": 13.649999768531869,
    "surface_wall_shear_rel_l2": 14.860903890173255,
    "surface_wall_shear_equal_entity_rel_l2": 17.333124470950114,
    "volume_velocity_rel_l2": 19.625555147562995,
    "volume_pressure_rel_l2": 16.483139490427046,
    "surface_pressure_rel_l1": 7.325244182549756,
    "surface_wall_shear_rel_l1": 10.271282655919567,
    "volume_velocity_rel_l1": 16.3397120938982,
    "volume_pressure_rel_l1": 10.055426487272108,
    "velocity_profile_r2": -1.2201156198955223,
    "cp_cut_r2": 0.81147387449399,
    "surface_pressure_mae": 0.16415356072059042,
    "surface_wall_shear_mae": 0.0008018139498878999,
    "volume_velocity_mae": 130.44234220213337,
    "volume_pressure_mae": 0.3844185405266929,
    "surface_pressure_rmse": 0.3897822784903373,
    "surface_wall_shear_rmse": 0.0019267469997846925,
    "volume_velocity_rmse": 238.4981556777869,
    "volume_pressure_rmse": 0.8426158963234456,
    "cd_r2": 0.9137675382530103,
    "cl_r2": 0.8923532328922904,
    "c_drag_mae": 0.011962197913823918,
    "c_lift_mae": 0.0398846796502673,
    "c_pitch_mae": 0.04391872878222687
  },
  "profile_index_sha256": "a02af5cd023e0cf6ddcb8f0de6dd64b702de95351c3acdf6536fd3ab4f66624f",
  "profile_ground_truth_release_id": "hiliftaeroml-native-profile-truth-v1-candidate",
  "profile_ground_truth_manifest_sha256": "3e20b857e12055e16f1d248d125b8df62a3669c604411dc67322fe98d9ab4477",
  "scoring_support_release_id": "hiliftaeroml-native-all-splits-support-v1-candidate",
  "scoring_support_manifest_sha256": "98a9a8d015e42c80f5993e30da94201011bebf67ff44d5574a7ef68a8b5dfbee",
  "discretization_sha256": "e5764d207cdb8fc4e12eb4cd49070a9f517ede126fb581812971718f340caa79",
  "case_metrics_sha256": "68713a2a4355ed02986e03d7d5399542bbdc4acfe4bf9799de37125c0812cf05",
  "notes": "The frozen dataset-evaluator revision 68899f780d96b70f2badb5658971c87af0b17172 applies only to the native-v1 base field, force, and noncompact scoring implementation. The additive compact-v2 profile implementation is an unbound worktree candidate with no code revision or implementation-manifest SHA-256; its profile topology contract is b1fd29b2cb6c1c84c694ddffc5d85f6cd68fd175b79c3695a443aa78bf962c2f. Cp/velocity profile R2 was recomputed from prediction-only chunks against the explicitly supplied inactive local candidate evaluator-support release; this does not publish or activate profile intake.",
  "regional_diagnostics_sha256": "150ee3ab868297a23e0a5f6037a80e279031a87a2750814e2bf485a52c89eba0",
  "compact_profile_implementation_binding": {
    "status": "unbound_worktree_candidate",
    "activation_effect": "none",
    "code_revision": null,
    "implementation_manifest_sha256": null,
    "base_dataset_evaluator_scope": "native_v1_base_field_force_and_noncompact_scoring_only"
  }
}
