{
  "$schema": "https://fluidsbench.org/schemas/v3/evaluation-evidence.schema.json",
  "schema_version": "3.0",
  "submission_id": "hiliftaeroml-transolver-geometry-super-scarce-candidate-v1",
  "dataset_id": "hiliftaeroml",
  "dataset_version": "hiliftaeroml-native-v1-candidate",
  "split_id": "geometry_super_scarce",
  "split_sha256": "9ffe2f753bf4a3972ca79ba5373f91486f3a462ea883df874e2e58f92130f197",
  "case_set_id": "caseset-53990ea68fa6",
  "prediction_scope": "surface_and_volume",
  "reference_version": "hiliftaeroml-evaluator-v0.1-candidate",
  "dataset_evaluator_binding": {
    "status": "frozen",
    "reference_version": "hiliftaeroml-evaluator-v0.1-candidate",
    "code_revision": "68899f780d96b70f2badb5658971c87af0b17172"
  },
  "command": "python scripts/assemble_hiliftaeroml_schema_v3_candidate.py --config examples/hiliftaeroml-v3-candidate/transolver-sixsplit-candidate-configs/transolver-geometry-super-scarce-candidate-config.json --native-aggregate ../hiliftaeroml-transolver-submission-v1/aggregates/sixsplit_v1/geometry_super_scarce/aggregate-a --native-surface-outputs ../hiliftaeroml-transolver-submission-v1/outputs/sixsplit_v1/geometry_super_scarce --native-volume-outputs ../hiliftaeroml-transolver-submission-v1/outputs/sixsplit_v1/geometry_super_scarce --native-receipts ../hiliftaeroml-transolver-submission-v1/outputs/sixsplit_v1_receipts/geometry_super_scarce/receipts-a --candidate-compact-profile-support-release ../eval_runs/hilift_compact_profile_support_v2_candidate_20260906/release/hiliftaeroml-compact-profile-support-v2-candidate --output ../hiliftaeroml-transolver-submission-v1/release/sixsplit_schema_v3_compact_candidate_20260906/packages/geometry_super_scarce/package-a",
  "generated_at": "2026-09-06T11:54:23-07:00",
  "status": "submitted_evaluation",
  "metric_values": {
    "overall_score": 22.434230450272125,
    "field_score": 0.0,
    "force_score": 89.06353043083057,
    "diagnostic_score": 0.6733913702579268,
    "surface_pressure_rel_l2": 30.42544773779047,
    "surface_pressure_equal_entity_rel_l2": 33.814068858951615,
    "surface_wall_shear_rel_l2": 32.578294906891664,
    "surface_wall_shear_equal_entity_rel_l2": 35.993712749141814,
    "volume_velocity_rel_l2": 34.32809311620016,
    "volume_pressure_rel_l2": 35.30305091569815,
    "surface_pressure_rel_l1": 20.400044016089662,
    "surface_wall_shear_rel_l1": 23.84529971556452,
    "volume_velocity_rel_l1": 31.380235491937775,
    "volume_pressure_rel_l1": 22.896314101985595,
    "velocity_profile_r2": -6.918719100290903,
    "cp_cut_r2": 0.01683478425644817,
    "surface_pressure_mae": 0.4263168760050425,
    "surface_wall_shear_mae": 0.0018900916050351524,
    "volume_velocity_mae": 303.81602038561596,
    "volume_pressure_mae": 0.9623971646313202,
    "surface_pressure_rmse": 1.0158349647890659,
    "surface_wall_shear_rmse": 0.004377621980148563,
    "volume_velocity_rmse": 491.65872363549425,
    "volume_pressure_rmse": 2.0682667614610013,
    "cd_r2": 0.9512374636087315,
    "cl_r2": 0.7997320653576669,
    "c_drag_mae": 0.028421115834138887,
    "c_lift_mae": 0.09555146739983324,
    "c_pitch_mae": 0.10049785190385625
  },
  "profile_index_sha256": "70fa8dc1b299af6b9ef045bb9506aa7d5d4748d49c901a9c609886e5d8a936a2",
  "profile_ground_truth_release_id": "hiliftaeroml-native-profile-truth-v1-candidate",
  "profile_ground_truth_manifest_sha256": "3e20b857e12055e16f1d248d125b8df62a3669c604411dc67322fe98d9ab4477",
  "scoring_support_release_id": "hiliftaeroml-native-all-splits-support-v1-candidate",
  "scoring_support_manifest_sha256": "98a9a8d015e42c80f5993e30da94201011bebf67ff44d5574a7ef68a8b5dfbee",
  "discretization_sha256": "2a4c1b2be32d8085f97fa9607ee1e737ee07c06c31485e14397e1bdc2cd1158d",
  "case_metrics_sha256": "30a2c9c5b5003ea007cc557a00721f2fdd346725b4166a1e16838c4795617220",
  "notes": "The frozen dataset-evaluator revision 68899f780d96b70f2badb5658971c87af0b17172 applies only to the native-v1 base field, force, and noncompact scoring implementation. The additive compact-v2 profile implementation is an unbound worktree candidate with no code revision or implementation-manifest SHA-256; its profile topology contract is b1fd29b2cb6c1c84c694ddffc5d85f6cd68fd175b79c3695a443aa78bf962c2f. Cp/velocity profile R2 was recomputed from prediction-only chunks against the explicitly supplied inactive local candidate evaluator-support release; this does not publish or activate profile intake.",
  "regional_diagnostics_sha256": "4c121c36f19baf087e12da12753cc32f5519a5d7baade55d6b8b64cb8feeb66b",
  "compact_profile_implementation_binding": {
    "status": "unbound_worktree_candidate",
    "activation_effect": "none",
    "code_revision": null,
    "implementation_manifest_sha256": null,
    "base_dataset_evaluator_scope": "native_v1_base_field_force_and_noncompact_scoring_only"
  }
}
